{
  "$schema": "http://json-schema.org/draft-07/schema#",
  "type": "object",
  "description": "Schema for Zosma Cowork Office document templates",
  "required": ["name", "displayName", "type", "palette", "fonts"],
  "properties": {
    "name": {
      "type": "string",
      "description": "Unique template identifier (kebab-case)"
    },
    "displayName": {
      "type": "string",
      "description": "Human-readable template name"
    },
    "description": {
      "type": "string",
      "description": "Brief description of the template"
    },
    "type": {
      "type": "string",
      "enum": ["docx", "pptx", "xlsx"],
      "description": "Document type"
    },
    "version": {
      "type": "string",
      "description": "Semantic version of the template",
      "pattern": "^\\d+\\.\\d+\\.\\d+$"
    },
    "author": {
      "type": "string",
      "description": "Template author"
    },
    "palette": {
      "type": "object",
      "description": "Color palette for the template",
      "required": ["primary", "accent", "background", "text"],
      "properties": {
        "primary": { "type": "string", "pattern": "^#[0-9A-Fa-f]{6}$" },
        "accent": { "type": "string", "pattern": "^#[0-9A-Fa-f]{6}$" },
        "background": { "type": "string", "pattern": "^#[0-9A-Fa-f]{6}$" },
        "text": { "type": "string", "pattern": "^#[0-9A-Fa-f]{6}$" },
        "lightAccent": { "type": "string", "pattern": "^#[0-9A-Fa-f]{6}$" },
        "success": { "type": "string", "pattern": "^#[0-9A-Fa-f]{6}$" }
      }
    },
    "fonts": {
      "type": "object",
      "description": "Font configuration",
      "required": ["heading", "body"],
      "properties": {
        "heading": { "type": "string" },
        "body": { "type": "string" }
      }
    },
    "slides": {
      "type": "array",
      "description": "Slide definitions (for PPTX templates)",
      "items": {
        "type": "object",
        "properties": {
          "title": { "type": "string" },
          "layout": { "type": "string", "enum": ["title", "content", "section", "blank", "twoContent", "comparison"] },
          "elements": {
            "type": "array",
            "items": { "$ref": "#/definitions/Element" }
          }
        }
      }
    },
    "sections": {
      "type": "array",
      "description": "Section definitions (for DOCX/XLSX templates)",
      "items": {
        "type": "object",
        "properties": {
          "type": { "type": "string" },
          "title": { "type": "string" },
          "content": { "type": "string" },
          "subtitle": { "type": "string" },
          "chartType": { "type": "string" },
          "rows": { "type": "integer", "minimum": 1 },
          "columns": { "type": "integer", "minimum": 1 }
        }
      }
    }
  },
  "definitions": {
    "Element": {
      "type": "object",
      "properties": {
        "type": { "type": "string", "enum": ["shape", "textBox", "chart", "table", "image"] },
        "content": { "type": "string" },
        "properties": {
          "type": "object",
          "properties": {
            "font": { "type": "object" },
            "fill": { "type": "object" },
            "position": { "type": "object", "properties": { "x": { "type": "number" }, "y": { "type": "number" } } },
            "size": { "type": "object", "properties": { "width": { "type": "number" }, "height": { "type": "number" } } },
            "chartType": { "type": "string" },
            "rows": { "type": "integer" },
            "columns": { "type": "integer" }
          }
        }
      }
    }
  }
}
