{
  "$schema": "./template-schema.json",
  "name": "technical-proposal",
  "displayName": "Technical Proposal",
  "description": "6-8 page technical proposal for client engagements",
  "type": "docx",
  "version": "1.0.0",
  "author": "Zosma Cowork",
  "palette": {
    "primary": "#1E1E1E",
    "accent": "#2563EB",
    "background": "#FAFAFA",
    "text": "#333333",
    "lightAccent": "#F1F5F9",
    "success": "#059669"
  },
  "fonts": {
    "heading": "Calibri",
    "body": "Calibri"
  },
  "sections": [
    { "type": "coverPage", "title": "{{ProjectName}}", "subtitle": "Technical Proposal", "content": "Prepared for {{ClientName}} by {{Author}}" },
    { "type": "pageBreak" },
    { "type": "heading1", "content": "Executive Summary" },
    { "type": "paragraph", "content": "{{ExecutiveSummary}}" },
    { "type": "pageBreak" },
    { "type": "heading1", "content": "1. Technical Approach" },
    { "type": "heading2", "content": "1.1 Architecture Overview" },
    { "type": "paragraph", "content": "{{ArchitectureDescription}}" },
    { "type": "heading2", "content": "1.2 Technology Stack" },
    { "type": "table", "rows": 8, "columns": 3 },
    { "type": "heading2", "content": "1.3 Key Design Decisions" },
    { "type": "paragraph", "content": "{{DesignDecisions}}" },
    { "type": "pageBreak" },
    { "type": "heading1", "content": "2. Implementation Plan" },
    { "type": "paragraph", "content": "{{ImplementationPlan}}" },
    { "type": "heading2", "content": "2.1 Phases" },
    { "type": "table", "rows": 6, "columns": 4 },
    { "type": "pageBreak" },
    { "type": "heading1", "content": "3. Timeline & Milestones" },
    { "type": "chart", "chartType": "gantt", "title": "Project Timeline" },
    { "type": "pageBreak" },
    { "type": "heading1", "content": "4. Budget & Resources" },
    { "type": "table", "rows": 10, "columns": 4 },
    { "type": "pageBreak" },
    { "type": "heading1", "content": "5. Team Qualifications" },
    { "type": "paragraph", "content": "{{TeamDescription}}" },
    { "type": "pageBreak" },
    { "type": "heading1", "content": "6. Terms & Conditions" },
    { "type": "paragraph", "content": "{{TermsAndConditions}}" }
  ]
}
