{
  "$schema": "./template-schema.json",
  "name": "academic-paper",
  "displayName": "Academic Paper",
  "description": "Standard academic paper template with IEEE citation format",
  "type": "docx",
  "version": "1.0.0",
  "author": "Zosma Cowork",
  "palette": {
    "primary": "#1A1A2E",
    "accent": "#8B5CF6",
    "background": "#FFFFFF",
    "text": "#2D2D2D",
    "lightAccent": "#F5F3FF",
    "success": "#7C3AED"
  },
  "fonts": {
    "heading": "Times New Roman",
    "body": "Times New Roman"
  },
  "sections": [
    { "type": "coverPage", "title": "{{PaperTitle}}", "subtitle": "{{Authors}} — {{Affiliation}}", "content": "{{Abstract}}" },
    { "type": "pageBreak" },
    { "type": "heading1", "content": "I. Introduction" },
    { "type": "paragraph", "content": "{{Introduction}}" },
    { "type": "pageBreak" },
    { "type": "heading1", "content": "II. Related Work" },
    { "type": "paragraph", "content": "{{RelatedWork}}" },
    { "type": "pageBreak" },
    { "type": "heading1", "content": "III. Methodology" },
    { "type": "heading2", "content": "3.1 Approach" },
    { "type": "paragraph", "content": "{{MethodologyApproach}}" },
    { "type": "heading2", "content": "3.2 Experimental Setup" },
    { "type": "paragraph", "content": "{{ExperimentalSetup}}" },
    { "type": "heading2", "content": "3.3 Evaluation Metrics" },
    { "type": "paragraph", "content": "{{EvaluationMetrics}}" },
    { "type": "pageBreak" },
    { "type": "heading1", "content": "IV. Results" },
    { "type": "paragraph", "content": "{{Results}}" },
    { "type": "table", "rows": 8, "columns": 4 },
    { "type": "chart", "chartType": "bar", "title": "Experimental Results" },
    { "type": "pageBreak" },
    { "type": "heading1", "content": "V. Discussion" },
    { "type": "paragraph", "content": "{{Discussion}}" },
    { "type": "pageBreak" },
    { "type": "heading1", "content": "VI. Conclusion & Future Work" },
    { "type": "paragraph", "content": "{{Conclusion}}" },
    { "type": "pageBreak" },
    { "type": "heading1", "content": "References" },
    { "type": "paragraph", "content": "{{References}}" }
  ]
}
