{
  "$schema": "./template-schema.json",
  "name": "startup-pitch",
  "displayName": "Startup Pitch Deck",
  "description": "12-slide investor pitch deck with financial model",
  "type": "pptx",
  "version": "1.0.0",
  "author": "Zosma Cowork",
  "palette": {
    "primary": "#0F172A",
    "accent": "#6366F1",
    "background": "#FFFFFF",
    "text": "#1E293B",
    "lightAccent": "#EEF2FF",
    "success": "#10B981"
  },
  "fonts": {
    "heading": "Inter",
    "body": "Inter"
  },
  "slides": [
    {
      "title": "Title Slide",
      "layout": "title",
      "elements": [
        { "type": "shape", "properties": { "fill": { "color": "#0F172A" }, "position": { "x": 0, "y": 0 }, "size": { "width": 960, "height": 540 } } },
        { "type": "textBox", "content": "{{CompanyName}}", "properties": { "font": { "size": 44, "bold": true, "color": "#FFFFFF" }, "position": { "x": 80, "y": 180 } } },
        { "type": "textBox", "content": "{{Tagline}}", "properties": { "font": { "size": 18, "color": "#A5B4FC" }, "position": { "x": 80, "y": 250 } } }
      ]
    },
    {
      "title": "Problem",
      "layout": "content",
      "elements": [
        { "type": "textBox", "content": "The Problem", "properties": { "font": { "size": 36, "bold": true, "color": "#0F172A" }, "position": { "x": 60, "y": 40 } } },
        { "type": "textBox", "content": "{{ProblemDescription}}", "properties": { "font": { "size": 16, "color": "#1E293B" }, "position": { "x": 60, "y": 120 } } }
      ]
    },
    {
      "title": "Solution",
      "layout": "content",
      "elements": [
        { "type": "textBox", "content": "Our Solution", "properties": { "font": { "size": 36, "bold": true, "color": "#0F172A" }, "position": { "x": 60, "y": 40 } } },
        { "type": "textBox", "content": "{{SolutionDescription}}", "properties": { "font": { "size": 16, "color": "#1E293B" }, "position": { "x": 60, "y": 120 } } }
      ]
    },
    {
      "title": "How It Works",
      "layout": "content",
      "elements": [
        { "type": "textBox", "content": "How It Works", "properties": { "font": { "size": 36, "bold": true, "color": "#0F172A" }, "position": { "x": 60, "y": 40 } } },
        { "type": "textBox", "content": "{{ArchitectureDescription}}", "properties": { "font": { "size": 14, "color": "#1E293B" }, "position": { "x": 60, "y": 120 } } }
      ]
    },
    {
      "title": "Market Opportunity",
      "layout": "content",
      "elements": [
        { "type": "textBox", "content": "Market Opportunity", "properties": { "font": { "size": 36, "bold": true, "color": "#0F172A" }, "position": { "x": 60, "y": 40 } } },
        { "type": "chart", "properties": { "chartType": "bar", "position": { "x": 60, "y": 120 }, "size": { "width": 500, "height": 350 } } }
      ]
    },
    {
      "title": "Business Model",
      "layout": "content",
      "elements": [
        { "type": "textBox", "content": "Business Model", "properties": { "font": { "size": 36, "bold": true, "color": "#0F172A" }, "position": { "x": 60, "y": 40 } } },
        { "type": "textBox", "content": "{{BusinessModel}}", "properties": { "font": { "size": 14, "color": "#1E293B" }, "position": { "x": 60, "y": 120 } } }
      ]
    },
    {
      "title": "Traction",
      "layout": "content",
      "elements": [
        { "type": "textBox", "content": "Traction & Milestones", "properties": { "font": { "size": 36, "bold": true, "color": "#0F172A" }, "position": { "x": 60, "y": 40 } } },
        { "type": "chart", "properties": { "chartType": "line", "position": { "x": 60, "y": 120 }, "size": { "width": 500, "height": 350 } } }
      ]
    },
    {
      "title": "Competitive Landscape",
      "layout": "content",
      "elements": [
        { "type": "textBox", "content": "Competitive Landscape", "properties": { "font": { "size": 36, "bold": true, "color": "#0F172A" }, "position": { "x": 60, "y": 40 } } },
        { "type": "table", "properties": { "rows": 6, "columns": 4, "position": { "x": 60, "y": 120 }, "size": { "width": 700, "height": 300 } } }
      ]
    },
    {
      "title": "Team",
      "layout": "content",
      "elements": [
        { "type": "textBox", "content": "Team", "properties": { "font": { "size": 36, "bold": true, "color": "#0F172A" }, "position": { "x": 60, "y": 40 } } },
        { "type": "textBox", "content": "{{TeamDescription}}", "properties": { "font": { "size": 14, "color": "#1E293B" }, "position": { "x": 60, "y": 120 } } }
      ]
    },
    {
      "title": "Financial Projections",
      "layout": "content",
      "elements": [
        { "type": "textBox", "content": "Financial Projections", "properties": { "font": { "size": 36, "bold": true, "color": "#0F172A" }, "position": { "x": 60, "y": 40 } } },
        { "type": "chart", "properties": { "chartType": "column", "position": { "x": 60, "y": 120 }, "size": { "width": 500, "height": 350 } } }
      ]
    },
    {
      "title": "Ask",
      "layout": "content",
      "elements": [
        { "type": "textBox", "content": "The Ask", "properties": { "font": { "size": 36, "bold": true, "color": "#0F172A" }, "position": { "x": 60, "y": 40 } } },
        { "type": "textBox", "content": "{{AskAmount}}", "properties": { "font": { "size": 28, "bold": true, "color": "#6366F1" }, "position": { "x": 60, "y": 150 } } },
        { "type": "textBox", "content": "{{UseOfFunds}}", "properties": { "font": { "size": 14, "color": "#1E293B" }, "position": { "x": 60, "y": 220 } } }
      ]
    },
    {
      "title": "Thank You",
      "layout": "blank",
      "elements": [
        { "type": "shape", "properties": { "fill": { "color": "#0F172A" }, "position": { "x": 0, "y": 0 }, "size": { "width": 960, "height": 540 } } },
        { "type": "textBox", "content": "Thank You", "properties": { "font": { "size": 44, "bold": true, "color": "#FFFFFF" }, "position": { "x": 380, "y": 200 } } },
        { "type": "textBox", "content": "{{ContactInfo}}", "properties": { "font": { "size": 16, "color": "#A5B4FC" }, "position": { "x": 370, "y": 280 } } }
      ]
    }
  ]
}
