{
  "$schema": "./template-schema.json",
  "name": "business-report",
  "displayName": "Business Report",
  "description": "8-10 page quarterly business report with charts",
  "type": "docx",
  "version": "1.0.0",
  "author": "Zosma Cowork",
  "palette": {
    "primary": "#1B3A5C",
    "accent": "#0078D4",
    "background": "#FFFFFF",
    "text": "#333333",
    "lightAccent": "#E8EFF7",
    "success": "#107C10"
  },
  "fonts": {
    "heading": "Arial",
    "body": "Arial"
  },
  "sections": [
    { "type": "coverPage", "title": "{{ReportTitle}}", "subtitle": "{{ReportPeriod}}", "content": "Prepared by {{Author}}" },
    { "type": "heading1", "content": "Executive Summary" },
    { "type": "paragraph", "content": "{{ExecutiveSummary}}" },
    { "type": "pageBreak" },
    { "type": "heading1", "content": "Table of Contents" },
    { "type": "toc" },
    { "type": "pageBreak" },
    { "type": "heading1", "content": "1. Introduction" },
    { "type": "paragraph", "content": "{{Introduction}}" },
    { "type": "pageBreak" },
    { "type": "heading1", "content": "2. Analysis" },
    { "type": "heading2", "content": "2.1 Key Metrics" },
    { "type": "table", "rows": 10, "columns": 5 },
    { "type": "chart", "chartType": "bar", "title": "Revenue by Quarter" },
    { "type": "heading2", "content": "2.2 Growth Trends" },
    { "type": "chart", "chartType": "line", "title": "User Growth" },
    { "type": "pageBreak" },
    { "type": "heading1", "content": "3. Findings" },
    { "type": "paragraph", "content": "{{Findings}}" },
    { "type": "pageBreak" },
    { "type": "heading1", "content": "4. Recommendations" },
    { "type": "paragraph", "content": "{{Recommendations}}" },
    { "type": "pageBreak" },
    { "type": "heading1", "content": "5. Conclusion" },
    { "type": "paragraph", "content": "{{Conclusion}}" },
    { "type": "pageBreak" },
    { "type": "heading1", "content": "Appendix" },
    { "type": "paragraph", "content": "{{Appendix}}" }
  ]
}
